|light|enhancedmenaceofdarthmaul|character| P1 | Qui-Gon Jinn, Jedi Protector|/enhancedmenaceofdarthmaul/light/quigonjinn.jpg | PM |
|light|enhancedmenaceofdarthmaul|character| P2 | Mace Windu, Jedi Warrior|/enhancedmenaceofdarthmaul/light/macewindu.jpg | PM |
|light|enhancedmenaceofdarthmaul|character| P3 | Queen Amidala, Cunning Warrior|/enhancedmenaceofdarthmaul/light/queenamidala.jpg | PM |
|dark|enhancedmenaceofdarthmaul|character| P4 | Darth Maul, Sith Assassin|/enhancedmenaceofdarthmaul/dark/darthmaul.jpg | PM |
|dark|enhancedmenaceofdarthmaul|character| P5 | Sebulba, Champion Podracer Pilot|/enhancedmenaceofdarthmaul/dark/sebulba.jpg | PM |
|dark|enhancedmenaceofdarthmaul|character| P6 | Trade Federation Tank, Assault Leader|/enhancedmenaceofdarthmaul/dark/tradefederationtank.jpg | PM |